{"cases":[{"cdf":[0.0200023683,0.0999915001,0.3000001783,0.5,0.6999998217,0.9000084999,0.9799976317],"discrete":false,"dist":"normal","p":[0.001,0.01,0.05,0.25,0.5,0.75,0.95,0.99,0.999],"params":{"mu":0.0,"sigma":1.0},"pdf":[0.0484229997,0.1754874387,0.3476927077,0.3989422804,0.3476927077,0.1754874387,0.0484229997],"quantile":[-3.0902323062,-2.326347874,-1.644853627,-0.6744897502,0.0,0.6744897502,1.644853627,2.326347874,3.0902323062],"x":[-2.0537,-1.2816,-0.5244,0.0,0.5244,1.2816,2.0537]},{"cdf":[0.0199999473,0.1000002748,0.3000001783,0.5,0.6999998217,0.8999997252,0.9800000527],"discrete":false,"dist":"normal","p":[0.001,0.01,0.05,0.25,0.5,0.75,0.95,0.99,0.999],"params":{"mu":1.5,"sigma":2.0},"pdf":[0.0242090138,0.087749342,0.1738463538,0.1994711402,0.1738463538,0.087749342,0.0242090138],"quantile":[-4.6804646123,-3.1526957481,-1.7897072539,0.1510204996,1.5,2.8489795004,4.7897072539,6.1526957481,7.6804646123],"x":[-2.6075,-1.0631,0.4512,1.5,2.5488,4.0631,5.6075]},{"cdf":[0.0199989056,0.0999843235,0.3000085659,0.4999984985,0.6999873174,0.8999971313,0.9799998244],"discrete":false,"dist":"lognormal","p":[0.001,0.01,0.05,0.25,0.5,0.75,0.95,0.99,0.999],"params":{"mu":0.2,"sigma":0.6},"pdf":[0.2265388748,0.5166291024,0.6498768384,0.5443784188,0.3463830093,0.1110027502,0.0192682826],"quantile":[0.1912565834,0.3024592491,0.4552483539,0.8148967588,1.2214027582,1.830691657,3.2769469342,4.9323163443,7.800122071],"x":[0.3562,0.5661,0.8917,1.2214,1.673,2.6351,4.1881]},{"cdf":[0.0200176746,0.099996054,0.2999940668,0.5,0.6999905857,0.8999988074,0.9800001433],"discrete":false,"dist":"lognormal","p":[0.001,0.01,0.05,0.25,0.5,0.75,0.95,0.99,0.999],"params":{"mu":0.0,"sigma":1.0},"pdf":[0.3776650956,0.6321803851,0.5874125744,0.3989422804,0.2058112649,0.0487201878,0.0062097243],"quantile":[0.0454913852,0.0976517331,0.1930408167,0.5094162839,1.0,1.9630310842,5.1802516022,10.2404736563,21.9821839796],"x":[0.1283,0.2776,0.5919,1.0,1.6894,3.6022,7.7971]},{"cdf":[0.0200029682,0.1000566501,0.2999321579,0.4999342266,0.7000550543,0.9000168716,0.9800033535],"discrete":false,"dist":"beta","p":[0.001,0.01,0.05,0.25,0.5,0.75,0.95,0.99,0.999],"params":{"a":2.5,"b":4.0},"pdf":[0.6054353412,1.3507654634,1.980923537,2.0281167886,1.6961802889,0.913167244,0.3117298134],"quantile":[0.0221047426,0.057264265,0.1148196419,0.2482814568,0.3721324312,0.5088260849,0.6973994509,0.8056324123,0.8939321883],"x":[0.0769,0.1577,0.274,0.3721,0.4781,0.6302,0.7655]},{"cdf":[0.0198712946,0.1000293638,0.2999813622,0.5000073288,0.7000181356,0.9000360243,0.9800102843],"discrete":false,"dist":"beta","p":[0.001,0.01,0.05,0.25,0.5,0.75,0.95,0.99,0.999],"params":{"a":0.6,"b":0.8},"pdf":[6.2766378816,2.1511310031,1.0761700766,0.8244223888,0.7501954011,0.8512762029,1.2243337076],"quantile":[1.3036e-05,0.0006050348,0.0088365369,0.1272025505,0.3880911104,0.7124147096,0.9590518615,0.9944792326,0.999689184],"x":[0.0019,0.028,0.1713,0.3881,0.6458,0.9039,0.9869]},{"cdf":[0.0200070994,0.1000265787,0.2999529484,0.4999532463,0.6999484396,0.8998849098,0.9800132325],"discrete":false,"dist":"beta","p":[0.001,0.01,0.05,0.25,0.5,0.75,0.95,0.99,0.999],"params":{"a":10.0,"b":3.0},"pdf":[0.3323105242,1.2254333215,2.6704044162,3.4404471991,3.5198840621,2.4444467931,1.0526193807],"quantile":[0.3564322151,0.4626570857,0.5618945649,0.6988211705,0.7833135892,0.8541479702,0.9281297445,0.9610178595,0.9827785246],"x":[0.5022,0.6145,0.7186,0.7833,0.8397,0.9043,0.9496]},{"cdf":[0.0199991223,0.0999969079,0.3000065393,0.4999974567,0.6999968937,0.8999985939,0.9799999404],"discrete":false,"dist":"gamma","p":[0.001,0.01,0.05,0.25,0.5,0.75,0.95,0.99,0.999],"params":{"scale":2.0,"shape":3.0},"pdf":[0.0456121583,0.1008621851,0.1350766651,0.1232973937,0.0879175017,0.0345695072,0.0076836042],"quantile":[0.3810667551,0.8720903302,1.6353828943,3.4545988357,5.3481206274,7.8408041206,12.5915872437,16.8118938298,22.4577444848],"x":[1.1344,2.2041,3.8276,5.3481,7.2311,10.6446,15.0332]},{"cdf":[0.01999393,0.0999748057,0.3000148634,0.4999840634,0.7000010637,0.9000005413,0.9800002492],"discrete":false,"dist":"gamma","p":[0.001,0.01,0.05,0.25,0.5,0.75,0.95,0.99,0.999],"params":{"scale":1.5,"shape":0.7},"pdf":[2.8507910959,1.3808495811,0.7321892643,0.4473811236,0.2433614719,0.0748274266,0.014331315],"quantile":[6.77559e-05,0.0018189345,0.0182447991,0.1946473858,0.6111356227,1.4422606303,3.573930028,5.8136080159,9.0956093458],"x":[0.0049,0.0497,0.2588,0.6111,1.2151,2.6357,4.8412]},{"cdf":[0.0200001998,0.0999970102,0.3000025823,0.4999934758,0.6999975773,0.900002359,0.9799994491],"discrete":false,"dist":"gamma","p":[0.001,0.01,0.05,0.25,0.5,0.75,0.95,0.99,0.999],"params":{"scale":0.5,"shape":20.0},"pdf":[0.030766948,0.0972840102,0.1702421654,0.1801694677,0.1453952047,0.0660850083,0.0164995971],"quantile":[4.4791066338,5.5410653132,6.6273257992,8.4150737307,9.8338362117,11.4040034047,13.9396198197,15.9226849379,18.3504893797],"x":[5.9594,7.2626,8.718,9.8338,11.0412,12.9513,15.109]},{"cdf":[0.670320046,0.9384480644,0.9920736681],"discrete":true,"dist":"poisson","p":[0.001,0.01,0.05,0.25,0.5,0.75,0.95,0.99,0.999],"params":{"lambda":0.4},"pdf":[0.670320046,0.2681280184,0.0536256037],"quantile":[0,0,0,0,0,1,2,2,3],"x":[0,1,2]},{"cdf":[0.0497870684,0.1991482735,0.4231900811,0.6472318888,0.8152632445,0.916082058,0.9961970079],"discrete":true,"dist":"poisson","p":[0.001,0.01,0.05,0.25,0.5,0.75,0.95,0.99,0.999],"params":{"lambda":3.0},"pdf":[0.0497870684,0.1493612051,0.2240418077,0.2240418077,0.1680313557,0.1008188134,0.0081015118],"quantile":[0,0,1,2,3,4,6,8,10],"x":[0,1,2,3,4,5,8]},{"cdf":[3.7267e-06,5.03098e-05,0.0148228746,0.1249161969,0.4057606888,0.5189752189,0.7250318842,0.9158366733,0.9906002225],"discrete":true,"dist":"poisson","p":[0.001,0.01,0.05,0.25,0.5,0.75,0.95,0.99,0.999],"params":{"lambda":12.5},"pdf":[3.7267e-06,4.65832e-05,0.0094773691,0.0550907338,0.1086859489,0.1132145301,0.0971965402,0.0465286747,0.0079083401],"quantile":[3,5,7,10,12,15,19,21,25],"x":[0,1,5,8,11,12,14,17,21]},{"cdf":[0.0,0.0,0.011921574,0.1185966006,0.312384232,0.5296879612,0.7345127618,0.9164424724,0.9923988515],"discrete":true,"dist":"poisson","p":[0.001,0.01,0.05,0.25,0.5,0.75,0.95,0.99,0.999],"params":{"lambda":80.0},"pdf":[0.0,0.0,0.0033240368,0.0216941957,0.0392264267,0.0445566658,0.0370926143,0.0176179447,0.0024473434],"quantile":[54,60,66,74,80,86,95,102,109],"x":[0,1,60,69,75,80,85,92,102]}],"checks":{"max_abs_integral_error":5.70943292643733e-12,"max_abs_quantile_roundtrip_error":4.107825191113079e-15},"generated_at":"2026-10-11T00:00:00Z","schema_version":"v1","spec":{"functions":"analytics/special.py (Lanczos g=7 lgamma, incomplete gamma series/Lentz, incomplete beta Lentz) and analytics/dists.py","note":"Only exp, log, sqrt are used so the TypeScript port needs no library.","poisson_quantile":"smallest integer k with cdf(k) >= p"},"tags":{"cases":"DERIVED"},"tolerance":{"abs":1e-09,"note":"pdf/cdf/quantile of continuous cases; poisson quantiles are exact integers","rel":1e-09}}